job_id,category,job_title,job_description,job_skill_set,source
real_dv_014,DevOps Engineer,DevOps Engineer – Helm & Kubernetes,Write Helm charts and manage Kubernetes cluster operations for containerized microservices at scale.,"Kubernetes, Docker, Linux, Bash, AWS, CI/CD, Terraform, GitLab CI, Git",manual
real_dv_015,DevOps Engineer,DevOps Engineer – Jenkins,Manage Jenkins CI/CD infrastructure for 50+ microservices. Improve build times and pipeline reliability across teams.,"Jenkins, CI/CD, Docker, Bash, Linux, Kubernetes, AWS, Terraform, Git",manual
real_dv_016,DevOps Engineer,DevOps Engineer – Blue-Green Deployments,Implement blue-green and canary deployment strategies for zero-downtime releases on a Kubernetes platform.,"Kubernetes, Docker, CI/CD, AWS, Terraform, Linux, Bash, GitLab CI, Ansible",manual
real_dv_017,DevOps Engineer,DevOps Engineer – Terraform AWS,"Write infrastructure-as-code using Terraform for AWS resources including VPCs, ECS clusters, and RDS instances.","Terraform, AWS, Docker, Linux, Bash, Kubernetes, CI/CD, Ansible, Git",manual
real_dv_018,DevOps Engineer,DevOps Engineer – Database Operations,"Manage Redis and PostgreSQL clusters in production. Handle database backups, replication, and performance tuning.","Linux, Docker, Bash, AWS, Kubernetes, Terraform, Ansible, CI/CD, Git",manual
real_dv_019,DevOps Engineer,DevOps Engineer – MLOps,"Build MLOps infrastructure for model training, versioning, and deployment on AWS for the machine learning team.","AWS, Docker, Kubernetes, CI/CD, Terraform, Linux, Bash, Ansible, GitLab CI",manual
real_dv_020,DevOps Engineer,DevOps Engineer – Multi-cloud,Manage infrastructure across AWS and on-premise environments. Standardize tooling and improve platform consistency.,"AWS, Terraform, Kubernetes, Docker, Ansible, Linux, Bash, CI/CD, Git",manual
